{
  "version": "1.0",
  "supplier": "ionos-essentials",
  "hosting": {
    "locale": "en_US",
    "blog_public": true,
    "market": "de",
    "tenant": "ionos",
    "core_version": "6.8.3",
    "php_version": "8.3.26",
    "instance_created": 1760370182,
    "ssl_type": "letsencrypt",
    "hostname": "web123.ionos.example.com",
    "htaccess_md5": {
      "wp-content/aiowps_backups/.htaccess": {
        "md5": "4afd84b898945e884f88b7f2cda376c0",
        "use_cases": ["htaccess_deny_from_all"]
      },
      ".htaccess": {
        "md5": "8c2735e637d52076bdd0ccd8311737fa",
        "use_cases": ["htaccess_wordpress_permalinks", "htaccess_rewrite_engine_active"]
      }
    }
  },
  "wordpress": {
    "user_data": {
      "total_users": 1,
      "avail_roles": {
        "none": 0,
        "administrator": 1
      }
    },
    "active_theme": {
      "id": "twentytwentyfive",
      "version": "1.3",
      "parent_theme_slug": null,
      "auto_update": false
    },
    "active_plugins": [
      {
        "plugin_slug": "ionos-essentials/ionos-essentials.php",
        "version": "1.3.1",
        "auto_update": false
      },
      {
        "plugin_slug": "all-in-one-seo-pack/all_in_one_seo_pack",
        "version": "4.8.5",
        "auto_update": true
      },
      {
        "plugin_slug": "ionos-assistant",
        "version": "9.1.3",
        "auto_update": true
      },
      {
        "plugin_slug": "cv-demo-importer",
        "version": "1.0.6",
        "auto_update": true
      },
      {
        "plugin_slug": "elementor",
        "version": "3.30.2",
        "auto_update": true
      },
      {
        "plugin_slug": "essential-addons-for-elementor-lite/essential_adons_elementor",
        "version": "6.2.1",
        "auto_update": true
      },
      {
        "plugin_slug": "essential-blocks",
        "version": "5.5.3",
        "auto_update": true
      },
      {
        "plugin_slug": "extendify",
        "version": "1.19.6",
        "auto_update": true
      },
      {
        "plugin_slug": "ionos-journey",
        "version": "3.0.2",
        "auto_update": true
      },
      {
        "plugin_slug": "kubio/plugin",
        "version": "2.6.3",
        "auto_update": true
      },
      {
        "plugin_slug": "ionos-loop",
        "version": "2.1.7",
        "auto_update": true
      },
      {
        "plugin_slug": "ionos-marketplace",
        "version": "2.3.0",
        "auto_update": true
      },
      {
        "plugin_slug": "ionos-navigation",
        "version": "2.1.6",
        "auto_update": true
      },
      {
        "plugin_slug": "ionos-performance",
        "version": "3.0.2",
        "auto_update": true
      },
      {
        "plugin_slug": "royal-elementor-addons/wpr-addons",
        "version": "1.7.1027",
        "auto_update": true
      },
      {
        "plugin_slug": "ionos-security",
        "version": "2.5.6",
        "auto_update": true
      },
      {
        "plugin_slug": "ionos-sso",
        "version": "2.2.4",
        "auto_update": true
      },
      {
        "plugin_slug": "01-ext-ion2hs971",
        "version": "1.0.0",
        "auto_update": true
      },
      {
        "plugin_slug": "astra-sites",
        "version": "4.4.31",
        "auto_update": true
      },
      {
        "plugin_slug": "templately",
        "version": "3.2.8",
        "auto_update": true
      },
      {
        "plugin_slug": "header-footer-elementor",
        "version": "2.4.4",
        "auto_update": true
      },
      {
        "plugin_slug": "wpforms-lite/wpforms",
        "version": "1.9.6",
        "auto_update": true
      },
      {
        "plugin_slug": "yoast-test-helper",
        "version": "1.18",
        "auto_update": true
      }
    ],
    "posts": [
      {
        "type": "post",
        "count": 1
      },
      {
        "type": "page",
        "count": 2
      }
    ],
    "comments": {
      "total": 3,
      "comments_active": true
    },
    "uploads": {
      "file_count": 0,
      "size": 0
    },
    "installed_themes": 15,
    "installed_plugins": 1,
    "permalink_structure": "/%postname%",
    "siteurl": "http://localhost:8888",
    "home": "http://localhost:8888"
  },
  "events": [
    {
      "name": "login",
      "payload": {
        "type": "default"
      },
      "timestamp": 1760091258
    }
  ],
  "clicks": {
    "add-new-page": 1,
    "edit-site-navigation": 1
  },
  "plugin_data": {
    "ionos-essentials": {
      "dashboard": {
        "nba_status": {
          "create-page": "completed",
          "tools-and-security": "dismissed",
          "survey": "dismissed",
          "select-theme": null,
          "connect-domain": null
        },
        "ionos_essentials_nba_setup_completed": null
      },
      "security": {
        "IONOS_SECURITY_FEATURE_OPTION_XMLRPC": true,
        "IONOS_SECURITY_FEATURE_OPTION_PEL": true,
        "IONOS_SECURITY_FEATURE_OPTION_CREDENTIALS_CHECKING": true,
        "IONOS_SECURITY_FEATURE_OPTION_MAIL_NOTIFY": true
      },
      "maintenance": false
    },
    "extendify": {
      "extendify_onboarding_completed": false
    },
    "mcp": {
      "settings": {
        "enabled": true
      },
      "tracking": []
    }
  }
}
